{
  "$schema": "http://json-schema.org/draft-07/schema#",
  "$id": "sdl3cpp.runtime.config.v2",
  "title": "SDL3 C++ Runtime Config v2",
  "type": "object",
  "definitions": {
    "float3": {
      "type": "array",
      "items": {"type": "number"},
      "minItems": 3,
      "maxItems": 3
    }
  },
  "properties": {
    "schema_version": {"type": "integer"},
    "configVersion": {"type": "integer"},
    "extends": {
      "oneOf": [
        {"type": "string"},
        {"type": "array", "items": {"type": "string"}}
      ]
    },
    "launcher": {
      "type": "object",
      "properties": {
        "name": {"type": "string"},
        "description": {"type": "string"},
        "enabled": {"type": "boolean"}
      },
      "additionalProperties": true
    },
    "scripts": {
      "type": "object",
      "properties": {
        "entry": {"type": "string"},
        "lua_debug": {"type": "boolean"}
      },
      "additionalProperties": true
    },
    "runtime": {
      "type": "object",
      "properties": {
        "scene_source": {
          "type": "string",
          "enum": ["config", "lua"]
        }
      },
      "additionalProperties": true
    },
    "paths": {
      "type": "object",
      "properties": {
        "project_root": {"type": "string"},
        "scripts": {"type": "string"},
        "shaders": {"type": "string"}
      },
      "additionalProperties": true
    },
    "window": {
      "type": "object",
      "properties": {
        "title": {"type": "string"},
        "size": {
          "type": "object",
          "properties": {
            "width": {"type": "integer", "minimum": 0},
            "height": {"type": "integer", "minimum": 0}
          },
          "additionalProperties": true
        },
        "mouse_grab": {
          "type": "object",
          "properties": {
            "enabled": {"type": "boolean"},
            "grab_on_click": {"type": "boolean"},
            "release_on_escape": {"type": "boolean"},
            "start_grabbed": {"type": "boolean"},
            "hide_cursor": {"type": "boolean"},
            "relative_mode": {"type": "boolean"},
            "grab_mouse_button": {"type": "string"},
            "release_key": {"type": "string"}
          },
          "additionalProperties": true
        }
      },
      "additionalProperties": true
    },
    "input": {
      "type": "object",
      "properties": {
        "bindings": {"type": "object", "additionalProperties": true}
      },
      "additionalProperties": true
    },
    "scene": {
      "type": "object",
      "additionalProperties": true
    },
    "rendering": {
      "type": "object",
      "properties": {
        "bgfx": {
          "type": "object",
          "properties": {
            "renderer": {"type": "string"}
          },
          "additionalProperties": true
        },
        "materialx": {
          "type": "object",
          "properties": {
            "enabled": {"type": "boolean"},
            "parameters_enabled": {"type": "boolean"},
            "document": {"type": "string"},
            "shader_key": {"type": "string"},
            "material": {"type": "string"},
            "library_path": {"type": "string"},
            "library_folders": {"type": "array", "items": {"type": "string"}},
            "materials": {
              "type": "array",
              "items": {
                "type": "object",
                "properties": {
                  "enabled": {"type": "boolean"},
                  "document": {"type": "string"},
                  "shader_key": {"type": "string"},
                  "material": {"type": "string"},
                  "use_constant_color": {"type": "boolean"},
                  "constant_color": {"$ref": "#/definitions/float3"}
                },
                "additionalProperties": true
              }
            },
            "use_constant_color": {"type": "boolean"},
            "constant_color": {"$ref": "#/definitions/float3"}
          },
          "additionalProperties": true
        },
        "atmospherics": {
          "type": "object",
          "properties": {
            "ambient_strength": {"type": "number"},
            "fog_density": {"type": "number"},
            "fog_color": {"$ref": "#/definitions/float3"},
            "sky_color": {"$ref": "#/definitions/float3"},
            "gamma": {"type": "number"},
            "exposure": {"type": "number"},
            "enable_tone_mapping": {"type": "boolean"},
            "enable_shadows": {"type": "boolean"},
            "enable_ssgi": {"type": "boolean"},
            "enable_volumetric_lighting": {"type": "boolean"},
            "pbr_roughness": {"type": "number"},
            "pbr_metallic": {"type": "number"}
          },
          "additionalProperties": true
        }
      },
      "additionalProperties": true
    },
    "budgets": {
      "type": "object",
      "properties": {
        "vram_mb": {"type": "number", "minimum": 0},
        "max_texture_dim": {"type": "number", "minimum": 0},
        "gui_text_cache_entries": {"type": "number", "minimum": 0},
        "gui_svg_cache_entries": {"type": "number", "minimum": 0}
      },
      "additionalProperties": true
    },
    "crash_recovery": {
      "type": "object",
      "properties": {
        "heartbeat_timeout_ms": {"type": "number", "minimum": 0},
        "heartbeat_poll_interval_ms": {"type": "number", "minimum": 0},
        "memory_limit_mb": {"type": "number", "minimum": 0},
        "gpu_hang_frame_time_multiplier": {"type": "number", "minimum": 0},
        "max_consecutive_gpu_timeouts": {"type": "number", "minimum": 0},
        "max_lua_failures": {"type": "number", "minimum": 0},
        "max_file_format_errors": {"type": "number", "minimum": 0},
        "max_memory_warnings": {"type": "number", "minimum": 0}
      },
      "additionalProperties": true
    },
    "gui": {
      "type": "object",
      "properties": {
        "font": {
          "type": "object",
          "properties": {
            "use_freetype": {"type": "boolean"},
            "font_path": {"type": "string"},
            "font_size": {"type": "number"}
          },
          "additionalProperties": true
        },
        "opacity": {"type": "number"}
      },
      "additionalProperties": true
    },
    "render": {
      "type": "object",
      "properties": {
        "passes": {
          "type": "array",
          "items": {
            "type": "object",
            "properties": {
              "id": {"type": "string"},
              "type": {"type": "string"},
              "inputs": {
                "type": "object",
                "properties": {
                  "@delete": {"type": "array", "items": {"type": "string"}}
                },
                "additionalProperties": {"type": "string"}
              },
              "outputs": {
                "type": "object",
                "properties": {
                  "@delete": {"type": "array", "items": {"type": "string"}}
                },
                "additionalProperties": {
                  "anyOf": [
                    {"type": "string"},
                    {
                      "type": "object",
                      "properties": {
                        "format": {"type": "string"},
                        "usage": {"type": "string"}
                      },
                      "additionalProperties": true
                    }
                  ]
                }
              },
              "parameters": {"type": "object", "additionalProperties": true}
            },
            "additionalProperties": true
          }
        }
      },
      "additionalProperties": true
    },
    "materialx": {
      "type": "object",
      "properties": {
        "enabled": {"type": "boolean"},
        "document": {"type": "string"},
        "shader_key": {"type": "string"},
        "material": {"type": "string"},
        "library_path": {"type": "string"},
        "library_folders": {"type": "array", "items": {"type": "string"}},
        "materials": {
          "type": "array",
          "items": {
            "type": "object",
            "properties": {
              "enabled": {"type": "boolean"},
              "document": {"type": "string"},
              "shader_key": {"type": "string"},
              "material": {"type": "string"},
              "use_constant_color": {"type": "boolean"},
              "constant_color": {"$ref": "#/definitions/float3"}
            },
            "additionalProperties": true
          }
        },
        "use_constant_color": {"type": "boolean"},
        "constant_color": {"$ref": "#/definitions/float3"}
      },
      "additionalProperties": true
    },
    "materialx_materials": {
      "type": "array",
      "items": {
        "type": "object",
        "properties": {
          "enabled": {"type": "boolean"},
          "document": {"type": "string"},
          "shader_key": {"type": "string"},
          "material": {"type": "string"},
          "use_constant_color": {"type": "boolean"},
          "constant_color": {"$ref": "#/definitions/float3"}
        },
        "additionalProperties": true
      }
    },
    "config_file": {"type": "string"},
    "lua_script": {"type": "string"},
    "window_width": {"type": "integer", "minimum": 0},
    "window_height": {"type": "integer", "minimum": 0},
    "input_bindings": {"type": "object", "additionalProperties": true},
    "mouse_grab": {"type": "object", "additionalProperties": true},
    "gui_font": {"type": "object", "additionalProperties": true},
    "gui_opacity": {"type": "number"}
  },
  "additionalProperties": true
}
